0.1A,Pre-Tailoring Use,Do you wish to enable pre-tailoring options?,N
0.1,Purpose of the checklist,"The purpose of this checklist is to assist experienced accountants in determining whether financial statements comply with the disclosure requirements of:

- FRS 101 and/or relevant International Financial Reporting Standards (IFRSs) issued by the International Accounting Standards Board (IASB) as endorsed for use in the European Union;
- International Accounting Standards (IASs) issued by the International Accounting Standards Committee (IASC) and adopted by the IASB that are endorsed for use in the in the European Union; and ;
- Interpretations issued by International Financial Reporting Interpretations Committee (IFRIC) predecessor body, the Standing Interpretations Committee (SIC) that are endorsed for use in the European Union. IFRSs, IASs, IFRICs, and SICs are referred to collectively in this checklist as IFRSs.

As well as IFRS, various UK specific disclosures are included in the checklist. These include relevant disclosures derived from: - FRS 101, The Companies Acts (2006) & supporting legislation affecting accounts, directors' remuneration reports, & directors' reports; - AIM and Listing Rules; - The UK Corporate Governance Code; - Investment and Venture Capital Trusts SORP; - Guidelines for Portfolio Companies and Private Equity firms; - Guidance on the Strategic Report June 2014; - Summary financial statements; and - Preliminary announcements. There are also some example wordings for UK audit reports.",A
0.1.1a,Listing Rules,The checklist does not deal with Listing Rule and Disclosure and Transparency Rules requirements for entities that are not incorporated in the United Kingdom. They should instead consult the Listing Rules and Disclosure and Transparency Rules directly.,A
0.1.1,Purpose of the checklist,"We have tried to ensure that all requirements are included in the checklist and that the link between the tailoring questions and the disclosure requirements is robust. However we can give no warranty as to the accuracy or completeness of the software. It still remains the responsibility of the user to ensure that the financial statements comply with all disclosure requirements. Please be aware that this checklist does not cover the recognition, measurement and presentation requirements of IFRSs, although reference to these aspects of standards are made where is it is considered relevant, for example in help screens giving background information on disclosure requirements. Note: This checklist should generally only be used for accounting periods beginning on or after 1 March 2012. Where the financial statements are for a period beginning before this date, please contact Pentana in order to ascertain the most suitable checklist to apply in your scenario.",A
0.2,Introduction,"The user's answers to the tailoring questions will impact the disclosures identified as applicable to the financial statements in the detailed disclosure requirements section of the checklist. For example, if the user specifies that the entity does not have intangible assets in its financial statements, the user will not be prompted with the disclosure requirements applicable to intangible assets. It is therefore imperative that these questions are answered accurately. In order to answer the tailoring assumptions accurately the user must have a good understanding of the entity as well as the recognition, measurement and presentation requirements of all IFRSs applicable to the entity's financial statements You have to answer all tailoring questions before you can proceed with the detailed disclosure questions. In the case of a parent entity preparing consolidated financial statements, references to ""entity"" apply equally to its consolidated financial statements as well as its separate financial statements (if prepared) except for the following: · If a single financial report contains both consolidated financial statements and the separate financial statements of the parent, segment disclosures required by IAS 14 'Segment Reporting' or IFRS 8 'Operating Segments' only need to be presented on the basis of the consolidated financial statements; and · If the entity presents both consolidated financial statements and separate financial statements, disclosures required by IAS 33 'Earnings per Share' only need to be presented on the basis of consolidated financial statements.",A
0.3.0,UK Accounting period start,What is the first day of the entity’s accounting period?,01/01/2020
0.3.1,UK Accounting period end date,What is the accounting period end date?,31/12/2020
0.4.1,Warning,NOTE: Except where stated this checklist incorporates the disclosure requirements of the most recent standards issued by the IASB including those that have been endorsed for use in the European Union as at 31st March 2020.,A
0.5,First Accounting period,Is this the entity's first accounting period since incorporation?,N
0.5.1,Beginning of comparative period,Please enter the date of the beginning of the entity's comparative accounting period.,01/01/2020
0.5.2,Length of accounting period,"Is the period covered by the financial statements equal to one year? Note: You should answer ""Yes"" to this question if the accounts cover a 52 or 53 week period;",Y
0.6A.1,Overseas company,Is the entity an overseas company as defined in the Companies Act 2006? See Help for guidance.,N
0.6,UK Companies Act,Is it a UK Companies Act entity?,Y
0.6.0,Charity,Is the entity a charity?,N
0.6.0.2,UK Parent or subsidiary,"Which of the following best describes the entity?

(1) the entity is a parent but not a subsidiary

(2) the entity is a parent and a wholly-owned subsidiary

(3) the entity is a parent and a subsidiary, but not a wholly-owned subsidiary

(4) the entity is a subsidiary, but not a parent

(5) the entity is neither a parent nor a subsidiary

Note: Please see help text for definitions of a parent and subsidiary under IFRS 10 Consolidated Financial Statements and IAS 27 Consolidated and Separate Financial Statements.",2
0.6.1,UK Active or dormant entities,Was the entity active at any time in the period? (Answer 'yes' unless dormant as defined on the help screen),Y
0.6.1.1,UK Dormant subsidiary accounts exemption,Is the dormant entity intending to apply the subsidiary exemption from preparing individual accounts (see Help)?,N
0.6.2.5.3,Insurance Company,Is the entity an insurance company?,N
0.7,First time adoption of IFRS,"Are these the entity's first IFRS financial statements (see Help screen)?

Note: Please also answer this question as ""No"" to this question if the entity has applied IFRSs in the past (regardless of applying IFRS 1 or SIC-8) but its most recent previous annual financial statements did not contain an explicit and unreserved statement of compliance with IFRS, but in these financial statements the entity intends to not to apply IFRS 1 - First Time Adoption but IAS 8 instead.",N
0.7.1,Resuming the preparation of IFRS annual financial statements,"Has the entity has applied IFRSs in the past (regardless of applying IFRS 1 or SIC-8 in the past) but its most recent previous annual financial statements did not contain an explicit and unreserved statement of compliance with IFRS, but in these financial statements the entity does not intend to apply IFRS 1 - First Time Adoption, but instead apply IFRSs restrospectively in accordance with IAS 8?",Y
0.7.6,Changes in accounting policies or use of exemptions under IFRS 1,Has the entity changed its accounting policies or use of exemptions in IFRS 1 in these first IFRS financial statements since issuing its first IFRS interim financial report?,N
0.11,Listed ordinary or potential ordinary shares,"Are the entity's ordinary shares or potential ordinary shares traded in a public market (a domestic or foreign stock exchange or an over-the-counter market, including local or regional markets), or does the entity file, or is in the process of filing, its financial statements with a securities commission or other regulatory organisation for the purpose of issuing ordinary shares in a public market?",N
0.12,Other listed status,"Are any of the entity's other equity instruments (i.e. other than ordinary and potential ordinary shares) or debt instruments traded in a public market (a domestic or foreign stock exchange or an over-the-counter market, including local or regional markets), or does the entity file, or is in the process of filing, its financial statements with a securities commission or other regulatory organisation for the purpose of issuing ordinary shares in a public market?",N
0.9,Consolidated accounts requirement,Does the entity's ultimate or any intermediate parent prepare consolidated financial statements available for public use that comply with IFRSs?,N
0.12,Consolidated accounts,Is the entity a UK entity exempt from preparing consolidated financial statements under UK law? See Help for guidance.,N
0.14,Consolidated and separate financial statements,"The entity is required to prepare consolidated financial statements. Notwithstanding this requirement, the entity may be required to prepare separate financial statements (recording interests in subsidiaries, associates and jointly controlled entities at cost or as financial assets unless they are classified as held for sale). Do you want this checklist to include the disclosures required in the entity's separate financial statements as well as its consolidated financial statements?",Y
0.14.2.1,Separate financial statements,Is the entity preparing separate financial statements as its only financial statements?,N
0.14.3,IFRS 10 Consolidated Financial Statements- Types of Entity,"Please select the following entities which the entity has a relationship with for the purpose of applying IFRS 10 Consolidated Financial Statements:

(1) Subsidiaries

(2) Consolidated Structured Entities

(3) Unconsolidated Structured Entities",1b
0.14.3.1,Initial Application of IFRS 10 Consolidated Financial Statements,Is this the initial application of IFRS 10 to financial statements for a continuing user of IFRSs?,N
0.14.4,Investment entity status,At any time during the period was the entity an investment entity in accordance with the definitions as stated in IFRS 10 - Consolidated Financial Statements?,N
0.15,Non-controlling interests (minority interests),Are there any non-controlling interests (minority interests) in the group?,N
0.15.2,Subsidiary financial statements - reporting date different to parent,Are the financial statements of a subsidiary which are used in the preparation of consolidated financial statements of a date or for a period that is different from that of the consolidated financial statements?,N
0.16.1,Financial Institution,Is the entity a financial institution?,N
0.16.2,Limited Life Entity,Is the entity a limited life entity?,N
0.16.3,Venture Capital Organisation or Similar Entity,Is the entity a venture capital organisation that on initial recognition has designated investments in associates or jointly controlled entities at fair value through profit or loss or held for trading and are accounted for at fair value in accordance with IAS 39?,N
0.16.4,"Mutual Fund, Unit Trust or Similar Entity","Is the entity a mutual fund, unit trust or a similar entity including an investment-linked insurance fund that on initial recognition has designated investments in associates at fair value through profit or loss or held for trading and are accounted for at fair value in accordance with IAS 39?",N
0.16.4.4,Income Streams,"Does the entity have income streams (for example interest, revenues, royalties, dividends)?",N
0.16.4.4.1,Income Streams,Does the entity's income include revenue from contracts with customers?,N
0.16.5,Rate Regulated Activity,Do any of the entity's operations constitute rate regulated activity?,N
0.16.6,Commodity Trader/ Broker,Is the entity a commodity broker-trader that records its inventory at fair value less costs to sell under IAS 2 Inventories (see help text)?,N
0.16.7,Mutual insurer,Is the company a mutual insurer?,N
0.16.8,Insurance contracts,"Does the entity issue either:
Insurance Contracts (as defined in IFRS 4); or
Financial instruments with discretionary participation features (as defined in IFRS 4)?",N
0.16.8B,Practical expedient to reassess contracts,"Has the entity chosen to apply the practical expedient in C3 of IFRS 16 to not reassess whether a contract is, or contains, a lease at the date of initial application?",Y
0.18,Agricultural activity,Is the entity engaged in agricultural activity?,Y
0.18.1,Agriculture - holding of bearer plants,As part of the entity's agricultural activities does the entity hold bearer plants? (See help text),N
0.19,Concession operator or concession provider,Is the entity a concession operator or concession provider (see help screen),N
0.21,Hyperinflationary currency,Is the entity's functional currency the currency of a hyperinflationary economy?,N
,,(a) present its financial statements in a currency other than its functional currency?,N
,,(b) display any supplementary financial information in a currency different to its functional currency or presentation currency?,N
0.23,Foreign operations,Does the entity have any foreign operations?,Y
,,"(a) Property, plant and equipment",Y
,,(b) Investment property,N
,,(c) Goodwill,N
,,(d) Intangible assets other than goodwill,Y
,,(e) Investments in associates within the scope of IAS 28 'Investments in associates' (see Help! screen),N
,,(fa) Investments in Joint Arrangements in scope of IFRS 11 'Joint Arrangements'.,N
,,(g) Biological assets,N
,,(h) Inventories,N
,,(i) Provisions,Y
,,(j) Current tax liabilities or assets (or current tax expense / income during any period presented),Y
,,(k) Deferred tax liabilities or assets (or deferred tax expense / income during any period presented),Y
,,(l) Defined benefit plan assets or liabilities NB You should answer No to this question if the only defined benefit obligations are through multi-employer plans accounted for as a defined contribution scheme.,N
,,(o) are there any financial assets within the scope of IFRS 7 'Financial Instruments: Disclosures',Y
,,(p) are there any financial liabilities within the scope of IFRS 7 'Financial Instruments: Disclosures',Y
,,(q) Is the entity a lessor in accordance with IFRS 16?,Y
,,(r) Is the entity a lessee in accordance with IFRS 16?,Y
,,(s) Does the lessor have finance leases?,N
,,(t) Does the lessor have operating leases?,Y
0.24A,Practical expedient retrospectively,Has the entity chosen to apply the practical expedient in C5(b) of IFRS 16 to retrospectively apply this standard with the cumulative effect of initially apply the standard recognised at the date of initial application in accordance with C7 to C13?,Y
0.24B,Practical expedient retrospectively,Has the entity chosen to use one or more of the practical expedients in C10 of IFRS 16 to leases previously classified as operating leases?,Y
0.24BB,Amendments to IAS 16,Has the entity adopted the practical expedient in paragraph 46A of IFRS 16.  Note: This practical expedient is effective for annual reporting periods beginning on or after 1 June 2020. Earlier application is permitted including in financial statements not authorised for issue at 28 May 2020,N
,Warning - Biological Assets,You have stated that the entity is involved in agricultural activities and has bearer plants and you have selected that the entity does not have any Biological Assets. This can only be true if the only biological assets held by the entity are bearer plants and the accounting period start date is after 01 January 2016 or you have selected to early adopt the amendments to IAS41 and IAS16 issued on 30 June 2014. Please ensure you have answered correctly.,A
0.25.3,Hedges of a Net Investment in a Foreign Operation,Does the entity hedge the foreign currency risk arising from its net investments in a foreign operation and wish to qualify for hedge accounting under IAS 39?,N
0.25.6C,First Time adoption of IFRS 9,"Is the first time that the entity has adopted the latest selected IFRS 9 version, in these financial statements?

Note: Select ""Yes"" if the entity has previously adopted an older version of IFRS 9 (e.g. 2009) and now adopting a later IFRS 9 (e.g. 2014) early.",N
0.25.6.2,Classification of financial assets under IFRS 9,"Which of the following financial assets are recognised in the entity's financial statements?

(1) Financial assets measured at fair value through profit or loss as mandatorily required by IFRS 9.

(2) Financial assets measured at fair value through profit or loss as designated at initial recognition under IFRS 9.

(3) Financial assets measured at amortised cost.

(4) Financial assets measured at fair value through other comprehensive income.",2b
0.25.6.3,Classification of financial liabilites under IFRS 9,"Which of the following financial liabilities are recognised in the entity's financial statements?

(1) Financial liabilities measured at fair value through profit that meet the definition of held for trading under IFRS 9.

(2) Financial liabilities measured at fair value through profit or loss as designated at initial recognition under IFRS 9.

(3) Financial liabilities measured at amortised cost.",3b
0.25.8.4,Off-setting of recognised financial instruments,Does the entity have recognised financial instruments that are set off in accordance with paragraph 42 of IAS 32?,N
0.25.8.5,Recognised financial instruments - master netting arrangements and similar agreements,Does the entity have recognised financial instruments that are subject to an enforceable master netting arrangement (or similar agreement) irrespective of whether they are set off in accordance with paragraph 42 of IAS 32?,N
0.25.9A,Designation of financial asset(s) at FVTPL (IFRS 9),Has the entity designated as measured at fair value a financial asset (or group of financial assets) that would otherwise be measured at amortised cost?,N
0.25.10A,Reclassification of Financial Assets (IFRS 9),"Has the entity, in the current or previous reporting periods, reclassified any financial assets in accordance with paragraph 4.4.1 of IFRS 9?",N
0.25.12.1,Transfers of Financial Assets,Has the entity transferred financial assets that are not derecognised in their entirety?,N
0.25.12.2,Transfers of Financial Assets,Has the entity transferred financial assets that are have been derecognised but the entity has a continuing involvement in them?,N
0.25.13A,Pledging of collateral,Has the entity pledged financial assets as collateral for liabilities or contingent liabilities?,N
0.25.15,Compound financial instruments with multiple embedded derivatives,Has the entity issued a compound financial instrument (containing a liability and equity component) which has multiple embedded derivatives whose values are interdependent?,N
0.25.16,Defaults and breaches regarding loans payable,"Has there been a default or breach in respect of loans payable at the end of the reporting period (for example of principal, interest, sinking fund or redemption terms)?",N
0.25.17,Other defaults and breaches regarding other loans payable,"Have there been other breaches in respect of other loans payable at the end of the reporting period (breaches other than principal, interest, sinking fund or redemption terms) that permitted the lender to demand accelerated repayment and such breaches were not remedied, or the terms of the loan were not renegotiated on or before the end of the reporting period?",N
0.25.18,Cash flow hedges,Has the entity designated any cash flow hedges as described in IAS 39 (which qualify for hedge accounting under that standard)?,N
0.25.19,Fair Value hedges,Has the entity designated any fair value hedges as described in IAS 39 (which qualify for hedge accounting under that standard)?,N
0.25.21A,Fair value of financial instrument where market for instrument is not active,Is there a difference between the fair value at initial recognition and the amount that would be determined at that date using the valuation technique?,N
0.25.23,Contracts that contain a discretionary participating feature,Has the entity entered into contracts containing a discretionary participating feature where the fair value of that feature cannot be measured reliably?,N
0.25.24,Fee income and expense on financial items,Has the entity incurred fee income and/ or expense (other than amounts included in determining the effective interest rate) in respect of financial assets or financial liabilities that are not at fair value through profit or loss?,N
0.25.25,Fee income and expense in respect of trust and other fiduciary duties,"Has the entity incurred fee income and/ or expense in respect of financial assets that result in the holding or investing of assets on behalf of individuals, trust, retirement benefit plans, and other institutions?",N
0.25.26,Sensitivity analysis,Has the entity prepared a sensitivity analysis for market risk?,N
0.26.1.2,"Defined contribution plan
","Does the entity operate one or more defined contribution pension plans?
",N
,,(a) contingent assets?,N
,,(b) contingent liabilities?,Y
0.35A,"Multi-employer pension plans
","Is the entity a member of a multi-employer defined benefit scheme?
",N
0.35A.1.1,"Defined benefit plan between entities under common control
","Is the entity a member of a defined benefit plan that shares risks between entities under common control?
",N
0.36,Share capital,Does the entity have any equity instruments in issue (i.e. does the entity have a share capital)?,Y
0.37,Related party transactions,B,Y
0.37A,Separate management entity,Does the entity utilise key management services provided by a separate entity not otherwise related to the entity?,N
0.37.15A,Negative compensation,Is this period the period of initial application of the amendments to IFRS 9 prepayment features with negative compensation?,N
0.38,Impairment testing required,Does the entity have intangible assets other than goodwill with an indefinite useful economic life?,N
,,(a) Classified any operations as discontinued?,N
,,(b) Classified any assets or liabilities as belonging to a disposal group?,N
,,(c) Classified any non-current assets as held for sale?,N
,,(a) during the period?,N
,,(b) after the balance sheet date but before the financial statements are authorised for issue?,N
0.59.10,Completion of accounting for business combinations for where initial accounting incomplete,Are there any business combinations in the previous period (accounted for under IFRS 3(2008) for which the initial accounting for the business combination was incomplete in the previous reporting period but that accounting is now complete?,N
0.59.11,Unexpired contingent consideration arrangements (prior years),At the reporting date is there any unexpired or unsettled contingent consideration liability (or asset) relating to past business combinations accounted under IFRS 3(2008) or in respect of business combinations entered into in prior years?,N
0.6,Disposals,Did the entity dispose of any operations during the current or any prior period presented?,N
0.60.1,Distributions of Non- cash Assets to Owners in the reporting period,Has the entity made any distributions of non-cash assets to owners within the scope of IFRIC 17 during the reporting period? (see help screen),N
0.60.2,Distributions of Non- cash Assets to Owners after the end of the reporting period,Has the entity made any distributions of non-cash assets to owners within the scope of IFRIC 17 after the end of the reporting period but before the financial statements are authorised for issue? (see help screen),N
0.60.5,Loss of control of subsidiary undertaking during the reporting period,Has the parent entity lost control of any of its subsidiary undertakings during the reporting period (by way of disposal or otherwise)?,N
0.60.6,Changes in the ownership subsidiaries not resulting in a loss of control,Has there been a change in the parent entity's ownership interests in subsidiaries during the reporting period that have not resulted in a loss of control?,N
0.60.7,Discontinued operations and items held for sale,Are there any non-current assets (including disposal groups or subsidiaries) held for distribution to owners acting in their capacity of owners?,N
,,(a) Impairment losses of non-financial assets within the scope of IAS 36 'Impairment of assets' (see Help! screen) during the current or any period presented,Y
,,(b) Reversals of impairment losses of non-financial assets within the scope of IAS 36 'Impairment of assets' (see Help! screen) during the current or any prior period presented. Note that past impairments of goodwill cannot be reversed.,N
0.62,Impairment losses,"Which of the following applies to the entity? (1) An impairment loss or reversal of an impairment loss of an individual asset or cash generating unit recognised was material in its own right (2) Impairment losses or reversals of impairment losses of individual assets or cash generating units recognised were material in aggregate, but none were individually material. (3) The entity recognised impairment losses or reversals of impairment losses of individual assets or cash generating units, some of which were individually material, while others were material only when aggregated.",3
,,(a) Equity-settled share-based payment transactions?,N
,,(b) Cash-settled share-based payment transactions?,N
,,(c) Group Cash-settled Share-based Payments where another member of the group (for example the parent company) has the obligation to make the payments to the suppliers of goods or services (for example employees).,N
