0.67.1,Government grants,"Has the entity benefited from government grants in the current or any prior period presented? Note: You should answer ""yes"" to this question even where the entity did not receive any grants during any period presented if either of the following apply: · The entity has deferred income relating to a government grant at any balance sheet date presented or at the beginning of the earliest period presented; or · The entity has an asset at any balance sheet date presented or at the beginning of the earliest period presented, and that asset was initially recognised at an amount net of a grant received.",N
0.67.2,Incurring borrowing cost,"Has the entity incurred borrowing costs directly attributable to the construction of a qualifying asset (other than qualifying assets measured at fair value or inventories manufactured, or otherwise produced, in large quantities on a repetitive basis)?",N
0.68,"Property, plant and equipment","Does the entity have a policy of revaluing any class of property, plant and equipment? Note: You should answer ""No"" to this question if the entity: · Is a first time adopter of IFRS; and · Is applying a policy of cost going forward, but chooses to use fair value in its opening IFRS balance sheet as deemed cost for any item of property, plant and equipment.",N
0.71,Intangible assets,"Does the entity have a policy of revaluing any class of intangible assets? Note: You should answer ""No"" to this question if the entity: · Is a first time adopter of IFRS; and · Is applying a policy of cost going forward, but chooses to use fair value in its opening IFRS balance sheet as deemed cost for any intangible asset.",N
,,(a) for any reason other than the application of a new Standard or Interpretation?,N
,,(b) as a result of applying a new Standard or Interpretation in the year the Standard or Interpretation is effective,Y
,,"(c) as a result of applying a new Standard or Interpretation early, i.e. before its effective date",Y
0.75A,Change in accounting policy - effect at beginning of preceding period,Does the change in accounting policies referred to in your answer to question 0.74 have a material effect on the statement of financial position at the beginning of the preceding period?,N
0.77,Correction of prior period errors,Has the entity identified and corrected an error arising in the financial statements of a prior period?,N
0.77.1,Reclassification of items,Has the entity reclassified items in its financial statements that affect the reclassification of amounts presented in previous periods' financial statements?,N
0.78,Departure from the requirements of IFRSs,"Has the entity departed from the requirements of any Standard or Interpretation in the current or any prior period presented, because management have concluded that compliance would be so misleading so as to conflict with the objective of financial statements set out in the Framework for the Preparation and Presentation of Financial Statements adopted by the IASB in April 2001?",N
0.85,Voluntary application of IAS 33 'Earnings per Share',Is the entity voluntarily disclosing earnings per share in accordance with IAS 33 'Earnings per share'? Note: An entity voluntarily disclosing earnings per share must comply fully with IAS 33 'Earnings per Share',N
0.86.1,Puttable financial instruments classified as equity,Does the entity have any puttable financial instruments classified as equity instruments?,N
0.86.2,Instruments that impose on the entity obligations only on a liquidation,Does the entity have any instruments that impose an obligation to deliver to another party a pro-rata share of the net assets of the entity only on liquidation?,N
0.86.5,Extinguishing Financial Liabilities with Equity Instruments,Has the entity extinguished a financial liability (or part of a financial liability) by issuing equity instruments as consideration paid to extinguish the liability (or part of a liability)?,N
0.87.1A,Statement of Profit or Loss and Other Comprehensive Income,"In respect of the Statement of Profit or Loss and Other Comprehensive Income which of the following presentations has the entity decided to follow?

(1) the presentation of all items of income and expense in a single statement of profit or loss and other comprehensive income (with profit or loss and other comprehensive income presented in two sections)

OR

(2) the presentation of the profit or loss section in a separate statement of profit or loss, and the presentation of other comprehensive income in a separate statement.
",2
0.87.2,Presentation of income tax related to items of other comprehensive income,"In respect of the Presentation of income tax related to items of other comprehensive income which of the following presentations has the entity decided to follow?

(1) Presentation of other comprehensive income net of related tax effects; or

OR

(2) Presentation of other comprehensive income before related tax effects?",1
0.88,Exploration and evaluation activities,"Does the entity enter into the activities of the exploration for, and the evaluation of, mineral resources?",N
0.88.1,Oil and Gas Assets,Does the entity have oil and gas assets in the development or production phases?,N
,,(2) Are there assets and/or liabilities not measured at fair value but fair value is disclosed?,N
0.93,Disclosures ENCOURAGED by IFRSs,"Would you like the checklist to identify disclosures which entities are only ENCOURAGED to make, but not actually required to make for the financial statements to give a fair presentation?",Y
0.94,Compliance with IFRS Practice Statement 'Management Commentary',Do you want to check management commentary disclosures against the non-mandatory IFRS Practice Statement 'Management Commentary' issued by the IASB in December 2010?,N
0.100.2,UK Type of entity,What type of UK Companies Act entity is it? 1. Private company limited by shares 2. PLC (ie public) 3. Unlimited or limited by guarantee 4. LLP,1
0.104.4,UK Size,Under the Companies Act is the entity: 1.Small 2. Medium-Sized 3.Neither small nor medium-sized 4. Not sure (checklist will guide you)?,3
0.106.1,UK Group members prevent company being small,"Is the only reason that the company did not qualify as small, the fact that some other member of its group at some time in the financial year was from an ineligible category (see Help)?",Y
0.106.2,UK Directors' report exemptions,"Does the company want to use the directors' report disclosure exemptions, even though it cannot claim the small accounts exemptions?",N
0.106.3,UK Strategic report exemptions,Does the entity wish to use the Statutory Strategic Report exemptions?,N
0.106.4,UK Other matters,Does the strategic report contain other matters that the directors consider are of strategic importance (instead of them being in the directors' report through regulations under s416(4))?,Y
0.106.5,Non-financial information statement,"Was the company at any time within the financial year to which the strategic report relates: (a) a traded company, (b) a banking company, (c) an authorised insurance company, or (d) a company carrying on insurance market activity?",N
0.106.8,Non-financial information statement,Does the company wish to voluntarily prepare a non-financial information statement in its strategic report?,Y
0.107,UK Solus p&l not published,Is the Companies Act dispensation from publishing the entity's solus p&l account/income statement used?,N
0.107.0,UK Separate group accounts,Are the IFRS group accounts separate from the parent's accounts?,N
0.107.1,UK >250 employees,"Were there, on average for the financial year, more than 250 employees working wholly or mainly in the UK?",Y
0.107.2,UK Highest paid director,"Is the total of directors' emoluments equal to or in excess of £200,000?",Y
0.107.2.1,UK Directors' loans,"In respect of arrangements entered into on or after 1 October 2007, section 252 of the Companies Act 2006 extends the definition of 'connected person; in respect of the members of the close family included. The additions include: 1. any other person (of either sex) with whom the director lives as partner in an enduring family relationship [excluding the director's grandparent or grandchild, sister, brother, aunt or uncle, or nephew or niece]; 2. any children or step-children (under the age of 18) of that person in 1. above who live with the director; 3. the director's children or step-children (including adults); 4. the director's parents; 5. a trustee of a trust in which any of the persons referred to above is a beneficiary. In addition, section 252 uses the term 'connected with' rather than 'associated' in (c) above (but with no change in meaning), and in (f) above, refers to a 'firm that is a legal person under the law by which it is governed' rather than a Scottish firm.",A
0.107.5.1,UK Directors' advances & credits,"At any time in the financial year, did advances or credits granted to directors subsist?",N
0.107.5.2,UK Directors' guarantees,"At any time in the financial year, were there guarantees subsisting on behalf of directors?",N
0.107.6,UK Dormant subsidiaries,Are there any dormant subsidiaries?,Y
0.107.9,Greenhouse gas emissions,Does part 7A of schedule 7 of the large and medium-sized companies and groups (accounts and reports) regulations 2008 apply? See Help for guidance.,N
0.108.0,UK Code compliance,Does the entity voluntarily apply the UK Corporate Governance code?,N
0.108.1,QCA Code compliance,Does the entity voluntarily apply the Quoted Companes Alliance Corporate Governance Code?,N
0.108.0.2,Corporte gov arrangements,"Does the company satisfy either or both of the following requirements—
(a) it has more than 2000 employees;
(b)it has—
(i) a turnover of more than £200 million, and
(ii) a balance sheet total of more than £2 billion?",Y
0.108.3.1,UK Portfolio company under private equity,Do you want the software to check whether the report and accounts contains the enhanced disclosures for a portfolio company (see Help)?,N
0.108.4.2,UK Filing obligations,Is delivery in paper form?,Y
0.108.4.3,End of tailoring,"You have now reached the end of the tailoring questions. If you have answered all the tailoring questions, you may now complete the detailed checklist.",A
,,,End Tailoring